{
  "schema_version": 1,
  "id": "CH-05-HIDROSTATICA",
  "title": "Hidrostática",
  "path": "chapters/05-hidrostatica.tex",
  "status": "ready",
  "objectives": [
    "Derivar ∇p=ρg.",
    "Calcular fuerza y centro de presión.",
    "Enunciar Arquímedes con densidad constante."
  ],
  "prerequisites": [
    "Capítulos 1 y 3"
  ],
  "sources": [
    "SRC-ULE-GD-2026-27"
  ],
  "claims": [
    "CLM-HIDRO"
  ],
  "derivations": [
    "Ecuación hidrostática",
    "Centro de presión"
  ],
  "figures": [
    "fig:hidrostatica"
  ],
  "exercises": [
    "Compuerta 58,86 kN"
  ],
  "historical_scope": false,
  "notes": "Tema 3. Sin tabla ISA."
}
