{
  "schema_version": 1,
  "id": "CH-12-APROXIMACIONES",
  "title": "Aproximaciones de la guía",
  "path": "chapters/12-aproximaciones.tex",
  "status": "ready",
  "objectives": [
    "Escribir Stokes, la aproximación hidrostática, Boussinesq y el equilibrio geostrófico."
  ],
  "prerequisites": [
    "Capítulos 2 y 8"
  ],
  "sources": [
    "SRC-ULE-GD-2026-27"
  ],
  "claims": [
    "CLM-STOKES",
    "CLM-BOUSSINESQ",
    "CLM-GEO"
  ],
  "derivations": [
    "Límite de Stokes",
    "Boussinesq",
    "Componentes geostróficas"
  ],
  "figures": [
    "fig:geostrofico"
  ],
  "exercises": [
    "v=5,71 m/s con Ω dato"
  ],
  "historical_scope": false,
  "notes": "Tema 6."
}
