{
  "schema_version": 1,
  "id": "CH-02-MODELO",
  "title": "Modelo monodimensional y leyes de esfuerzos",
  "path": "chapters/02-modelo-monodimensional.tex",
  "status": "review",
  "objectives": [
    "Modelizar una estructura mediante barras y secciones.",
    "Identificar cargas y vinculaciones.",
    "Aplicar el criterio de signos del curso.",
    "Derivar y utilizar las leyes diferenciales de esfuerzos."
  ],
  "prerequisites": ["CH-01-FUNDAMENTOS", "Estática plana"],
  "sources": [
    "SRC-COURSE-T12-P2",
    "SRC-CERVERA-BLANCO",
    "SRC-MIT-BUCCIARELLI",
    "SRC-TUDELFT-FOUR"
  ],
  "claims": ["CLM-003", "CLM-004", "CLM-007"],
  "derivations": [
    "dN/dx = -qx",
    "dV/dx = -qy",
    "dM/dx = V"
  ],
  "figures": ["fig:vinculaciones-planas"],
  "exercises": [],
  "historical_scope": false,
  "notes": "El criterio de signos del material docente prevalece sobre convenciones externas."
}
