{
  "schema_version": 1,
  "id": "CH-01-CONTINUO",
  "title": "El fluido como continuo",
  "path": "chapters/01-continuo.tex",
  "status": "ready",
  "objectives": [
    "Situar la asignatura 0710311 y su evaluación.",
    "Formular la hipótesis del continuo.",
    "Distinguir fluido ideal, real, newtoniano e incompresible."
  ],
  "prerequisites": [
    "Cálculo y física de primer curso"
  ],
  "sources": [
    "SRC-ULE-GD-2026-27",
    "SRC-ULE-PLAN-2026-27",
    "SRC-ULE-GD-2024-25",
    "SRC-ULE-GD-2022-23"
  ],
  "claims": [
    "CLM-CURSO",
    "CLM-EVAL",
    "CLM-ALCANCE",
    "CLM-CONTINUO",
    "CLM-IDEAL",
    "CLM-NEWTONIANO-1D"
  ],
  "derivations": [
    "Corte simple newtoniano"
  ],
  "figures": [
    "fig: no hay figura propia; el mapa es el cuadro tab:mapa-temas"
  ],
  "exercises": [
    "Placas con aceite, fuerza 24 N"
  ],
  "historical_scope": false,
  "notes": "Tema 2 de la guía. Declara exclusiones."
}
