{
  "schema_version": 1,
  "id": "CH-08-NAVIER-STOKES",
  "title": "Navier-Stokes y soluciones exactas",
  "path": "chapters/08-navier-stokes.tex",
  "status": "ready",
  "objectives": [
    "Derivar NS y Euler.",
    "Resolver Couette, Poiseuille y el cilindro giratorio."
  ],
  "prerequisites": [
    "Capítulos 4, 6 y 7"
  ],
  "sources": [
    "SRC-ULE-GD-2026-27",
    "SRC-SHAUGHNESSY-2005",
    "SRC-WHITE-2016",
    "SRC-KUNDU-2016",
    "SRC-TRITTON-2011",
    "SRC-POWERS-2024"
  ],
  "claims": [
    "CLM-NS",
    "CLM-COUETTE",
    "CLM-POISEUILLE",
    "CLM-CILINDRO"
  ],
  "derivations": [
    "Navier-Stokes incompresible",
    "Poiseuille",
    "Potencia del cilindro"
  ],
  "figures": [
    "fig:poiseuille"
  ],
  "exercises": [
    "Potencia 0,628 W/m"
  ],
  "historical_scope": false,
  "notes": "Temas 3 y 6. Las lecturas se registran y no se citan por página."
}
