{
  "schema_version": 1,
  "id": "CH-06-CONSERVACION",
  "title": "Balances integrales",
  "path": "chapters/06-conservacion.tex",
  "status": "ready",
  "objectives": [
    "Demostrar el transporte de Reynolds.",
    "Escribir continuidad y momento integral."
  ],
  "prerequisites": [
    "Capítulos 3 y 4"
  ],
  "sources": [
    "SRC-ULE-GD-2026-27"
  ],
  "claims": [
    "CLM-RTT",
    "CLM-CONTINUIDAD"
  ],
  "derivations": [
    "Reynolds",
    "Continuidad",
    "Momento en volumen de control"
  ],
  "figures": [],
  "exercises": [
    "Chorro sobre placa, 25,6 N"
  ],
  "historical_scope": false,
  "notes": "Temas 5 y 6."
}
