{
  "schema_version": 1,
  "id": "CH-10-SEMEJANZA",
  "title": "Semejanza y análisis dimensional",
  "path": "chapters/10-semejanza.tex",
  "status": "ready",
  "objectives": [
    "Definir Reynolds.",
    "Operar el teorema Pi.",
    "Derivar Darcy laminar."
  ],
  "prerequisites": [
    "Capítulo 8"
  ],
  "sources": [
    "SRC-ULE-GD-2026-27"
  ],
  "claims": [
    "CLM-RE",
    "CLM-BUCKINGHAM",
    "CLM-CD",
    "CLM-DARCY"
  ],
  "derivations": [
    "Reynolds",
    "Buckingham",
    "f=64/Re_D"
  ],
  "figures": [],
  "exercises": [
    "Tubo Re=90",
    "Modelo a escala 1:10"
  ],
  "historical_scope": false,
  "notes": "Tema 4."
}
