{
  "schema_version": 1,
  "id": "CH-13-EXAMEN",
  "title": "Preparar el examen",
  "path": "chapters/13-examen.tex",
  "status": "ready",
  "objectives": [
    "Fijar la evaluación vigente.",
    "Reunir comprobaciones y un problema de síntesis original."
  ],
  "prerequisites": [
    "Capítulos 1 a 12"
  ],
  "sources": [
    "SRC-ULE-GD-2026-27",
    "SRC-WUOLAH-EXAM-ORD-2025",
    "SRC-WUOLAH-NOTES-FLUIDOS",
    "SRC-WUOLAH-RESUMEN-FLUIDOS",
    "SRC-ZORITA-VIDEOS",
    "SRC-WOLFRAM",
    "SRC-ANDERSON-1995"
  ],
  "claims": [
    "CLM-EVAL"
  ],
  "derivations": [
    "Poiseuille vertical"
  ],
  "figures": [],
  "exercises": [
    "Tubo vertical, grupo π/8"
  ],
  "historical_scope": false,
  "notes": "El examen Wuolah solo informa habilidades. No se copia."
}
