{
  "schema_version": 1,
  "id": "CH-03-PROBLEMAS",
  "title": "Problemas resueltos",
  "path": "chapters/03-problemas-resueltos.tex",
  "status": "review",
  "objectives": [
    "Resolver problemas representativos del Bloque I.",
    "Aplicar comprobaciones físicas, dimensionales y de contorno.",
    "Entrenar el patrón de resolución observado en material de examen."
  ],
  "prerequisites": ["CH-01-FUNDAMENTOS", "CH-02-MODELO"],
  "sources": [
    "SRC-COURSE-T12-P1",
    "SRC-COURSE-T12-P2",
    "SRC-WUOLAH-EXAM-2025",
    "SRC-CERVERA-BLANCO"
  ],
  "claims": ["CLM-004", "CLM-006", "CLM-007"],
  "derivations": [
    "Reacciones por equilibrio global",
    "Leyes V-M por tramos",
    "Comprobación inversa q-V-M"
  ],
  "figures": ["fig:ejercicio6-viga"],
  "exercises": [
    "resultantes de cargas distribuidas",
    "tensión y deformación",
    "vigas simplemente apoyadas",
    "voladizos",
    "rótula interna"
  ],
  "historical_scope": false,
  "notes": "Wuolah se utiliza como patrón de examen, no como autoridad científica."
}
