{
  "schema_version": 1,
  "id": "CH-05-FORMULARIO",
  "title": "Formulario y repaso",
  "path": "chapters/05-formulario-repaso.tex",
  "status": "review",
  "objectives": [
    "Concentrar ecuaciones esenciales junto a sus hipótesis.",
    "Permitir autoevaluación rápida sin perder contexto físico."
  ],
  "prerequisites": ["CH-01-FUNDAMENTOS", "CH-02-MODELO"],
  "sources": [
    "SRC-COURSE-T12-P1",
    "SRC-COURSE-T12-P2",
    "SRC-TUDELFT-FOUR"
  ],
  "claims": ["CLM-002", "CLM-003", "CLM-004", "CLM-005", "CLM-007"],
  "derivations": [],
  "figures": [],
  "exercises": ["preguntas rápidas de autoevaluación"],
  "historical_scope": false,
  "notes": "El formulario no sustituye a hipótesis ni convenciones."
}
