{
  "schema_version": 1,
  "id": "CH-07-ESFUERZOS",
  "title": "Esfuerzos y fluido newtoniano",
  "path": "chapters/07-esfuerzos.tex",
  "status": "ready",
  "objectives": [
    "Definir la tracción de Cauchy.",
    "Escribir la ley newtoniana incompresible."
  ],
  "prerequisites": [
    "Capítulos 3 y 6"
  ],
  "sources": [
    "SRC-ULE-GD-2026-27"
  ],
  "claims": [
    "CLM-NEWTONIANO-1D"
  ],
  "derivations": [
    "Ley 2μD"
  ],
  "figures": [
    "fig:cauchy"
  ],
  "exercises": [
    "Corte con divergencia nula del esfuerzo"
  ],
  "historical_scope": false,
  "notes": "Tema 5."
}
