{
  "schema_version": 1,
  "id": "CH-02-CLASICA",
  "title": "Mecánica clásica que el fluido va a usar",
  "path": "chapters/02-clasica.tex",
  "status": "ready",
  "objectives": [
    "Fijar Newton, energía, sistemas no inerciales y Euler-Lagrange.",
    "Derivar la resonancia de desplazamiento.",
    "Introducir el mapa logístico y el problema de N cuerpos sin parámetros inventados de Lorenz."
  ],
  "prerequisites": [
    "Capítulo 1"
  ],
  "sources": [
    "SRC-ULE-GD-2026-27",
    "SRC-TAYLOR-2005",
    "SRC-STROGATZ-2018",
    "SRC-LEWIN-801"
  ],
  "claims": [
    "CLM-EL",
    "CLM-ALCANCE"
  ],
  "derivations": [
    "Euler-Lagrange",
    "Amplitud y frecuencia de resonancia del desplazamiento",
    "Puntos fijos del mapa logístico"
  ],
  "figures": [
    "fig:no-inercial"
  ],
  "exercises": [
    "Oscilador m=2 kg"
  ],
  "historical_scope": false,
  "notes": "Tema 1 de la guía. Lorenz sin parámetros numéricos."
}
